Location,Time,Quantity,Keywords
Cape Hatteras National Park US,28-May-17,2484,sponsered obxnow obx
Sanderling Resort US,29-May-17,1799,sponsered obxnow obx
Sail Outer Banks US,30-May-17,2046,sponsered obxnow obx
"New York, New York",1-Jun-17,2860,diversity
Top Of The Rock NYC,2-Jun-17,3202,newyorkcity nationaldonutday newyorkbynewyorkers
"Pier 15, East River Splanade",6-Jun-17,2194,seaportdistrictnyc kanyguide
Solomon R. Guggenhein Museum,9-Jun-17,3037,flw150 emptyguggenheim kanyguide
Forest Hills Stadium US,10-Jun-17,2129,partner sony
"West Village, New York City",11-Jun-17,2639,kanyguide
Gantry Plaza State Park US,13-Jun-17,2217,kanyguidensunsetcity newyorkornowhere newyorkbynewyorkers sunsetsforbreakfast sunsethunters
Ditch Plains New York,15-Jun-17,2250,iloveny beachplease travelerinnewyork
"Montauket, Montauk",16-Jun-17,2443,montauk iloveny ihavethisthingwithbikes
The Oculus at the World Trade Center,19-Jun-17,2682,
Sheap's Meadow New York,22-Jun-17,2474,kanyguide iloveny centralparknyc newyorkornowhere
Downtown Charleston Historic Distict,3-Jul-17,2698,explorecharleston visittheusa theprettycities
"The Spectator Hotel Charleston, SC",4-Jul-17,2980,breakfastinbed hotellife morningslikethese
Rainbow Row US,5-Jul-17,2584,explorecharleston dametraveler fourthofjulyus
Sandy Bottom Lake US,15-Jul-17,2280,greygoose frenchobsessed
"New York, New York",21-Jul-17,2073,giveawaycontest
